{
  "$schema": "https://json-schema.org/draft/2020-12/schema",
  "$id": "https://fabric.local/schemas/fabric-theme.schema.json",
  "title": "Fabric Theme",
  "type": "object",
  "required": ["id", "name", "type", "tokens"],
  "additionalProperties": false,
  "properties": {
    "$schema": { "type": "string" },
    "id": { "type": "string", "minLength": 1 },
    "name": { "type": "string", "minLength": 1 },
    "type": { "enum": ["dark", "light"] },
    "iconVariant": { "enum": ["dark", "light"] },
    "tokens": {
      "type": "object",
      "additionalProperties": { "type": "string" }
    }
  }
}
