{
  "$schema": "../schema/fabric-theme.schema.json",
  "id": "fabric.custom-template",
  "name": "Fabric Custom Template",
  "type": "dark",
  "tokens": {
    "bg.base": "#f4f1eb",
    "bg.surface": "#ffffff",
    "bg.elevated": "#f8f7f4",
    "bg.overlay": "#ffffff",
    "bg.muted": "#f1efea",
    "bg.subtle": "#e8e2dc",
    "bg.inverse": "#111111",
    "bg.chrome": "#3a302c",
    "bg.chrome.elevated": "#4a3e39",
    "bg.chrome.hover": "rgba(255, 250, 244, 0.08)",
    "border": "#ddd7cf",
    "border.muted": "#ebe6df",
    "border.strong": "#cfc7bd",
    "border.chrome": "rgba(255, 250, 244, 0.12)",
    "text.primary": "#24211f",
    "text.secondary": "#5f5752",
    "text.muted": "#7a7069",
    "text.disabled": "#9f9690",
    "text.inverse": "#ffffff",
    "text.chrome": "#fff7ee",
    "text.chrome.muted": "#d8cbc2",
    "sidebar.bg": "var(--fabric-bg-chrome)",
    "sidebar.border": "var(--fabric-border-chrome)",
    "sidebar.divider": "var(--fabric-border-chrome)",
    "sidebar.text": "var(--fabric-text-chrome)",
    "sidebar.text.muted": "var(--fabric-text-chrome-muted)",
    "sidebar.link.text": "var(--fabric-text-chrome)",
    "topbar.bg": "var(--fabric-bg-chrome)",
    "topbar.border": "var(--fabric-border-chrome)",
    "topbar.search.bg": "rgba(255, 250, 244, 0.06)",
    "topbar.search.border": "var(--fabric-border-chrome)",
    "topbar.search.text": "var(--fabric-text-chrome-muted)",
    "topbar.search.hover.text": "var(--fabric-text-chrome)",
    "topbar.search.hover.bg": "var(--fabric-bg-chrome-hover)",
    "topbar.kbd.bg": "transparent",
    "topbar.button.bg": "rgba(255, 250, 244, 0.08)",
    "topbar.button.text": "var(--fabric-text-chrome)",
    "topbar.notificationBadge.text": "var(--fabric-text-chrome)",
    "button.primary.bg": "#24211f",
    "button.primary.text": "#ffffff",
    "button.primary.border": "#24211f",
    "button.primary.hover": "#393431",
    "button.primary.active": "#393431",
    "button.primary.active.text": "#ffffff",
    "button.secondary.bg": "#f1efea",
    "button.secondary.text": "#24211f",
    "button.secondary.border": "#ddd7cf",
    "button.secondary.hover": "#e8e2dc",
    "button.secondary.active": "#ddd7cf",
    "button.secondary.active.text": "#24211f",
    "button.ghost.bg": "transparent",
    "button.ghost.text": "#4b4540",
    "button.ghost.border": "transparent",
    "button.ghost.hover": "#e8e2dc",
    "button.ghost.active": "#ddd7cf",
    "button.ghost.active.text": "#24211f",
    "input.bg": "#ffffff",
    "input.border": "#d8d0c7",
    "input.border.focus": "#6b625b",
    "input.text": "#24211f",
    "input.placeholder": "#9f9690",
    "input.disabled.bg": "#f1efea",
    "baseButton.ghost.bg": "var(--fabric-button-ghost-bg)",
    "baseButton.ghost.text": "var(--fabric-button-ghost-text)",
    "baseButton.ghost.hover.bg": "var(--fabric-button-ghost-hover)",
    "baseButton.ghost.active.bg": "var(--fabric-button-ghost-active)",
    "baseSelect.bg": "var(--fabric-input-bg)",
    "baseSelect.border": "var(--fabric-input-border)",
    "baseModal.bg": "#fbfaf7",
    "baseModal.border": "#c8c0b7",
    "appPanel.bg": "var(--fabric-bg-surface)",
    "appPanel.border": "var(--fabric-border)",
    "globalSettings.nav.active.bg": "var(--fabric-button-ghost-active)",
    "globalSettings.nav.active.text": "var(--fabric-button-ghost-active-text)",
    "accent": "#6f4bd8",
    "accent.subtle": "#ede7ff",
    "border.brand": "#b9a7ff",
    "bg.canvas": "#fbfaf7",
    "status.success.bg": "#e7f6ec",
    "status.success.text": "#16723a",
    "status.success.border": "#a9ddbb",
    "status.running.bg": "#e9f0ff",
    "status.running.text": "#315fbd",
    "status.running.border": "#b7c9f5",
    "status.error.bg": "#fdeaea",
    "status.error.text": "#b42318",
    "status.error.border": "#f3b8b4",
    "status.draft.bg": "#f1efea",
    "text.error": "#b42318",
    "scrollbar.track": "transparent",
    "scrollbar.thumb": "#cfc7bd",
    "scrollbar.thumb.hover": "#bdb2a7",
    "button.outline.bg": "transparent",
    "button.outline.text": "var(--fabric-text-primary)",
    "button.outline.border": "var(--fabric-border-strong)",
    "button.outline.hover": "var(--fabric-bg-muted)",
    "button.outline.active": "var(--fabric-bg-subtle)",
    "button.outline.active.text": "var(--fabric-text-primary)",
    "button.danger.bg": "var(--fabric-status-error-bg)",
    "button.danger.text": "var(--fabric-status-error-text)",
    "button.danger.border": "var(--fabric-status-error-border)",
    "button.danger.hover": "var(--fabric-status-error-bg)",
    "button.danger.active": "var(--fabric-status-error-border)",
    "button.danger.active.text": "var(--fabric-status-error-text)",
    "button.disabled.bg": "var(--fabric-bg-muted)",
    "button.disabled.text": "var(--fabric-text-disabled)",
    "button.disabled.border": "var(--fabric-border-muted)",
    "baseButton.primary.bg": "var(--fabric-button-primary-bg)",
    "baseButton.primary.text": "var(--fabric-button-primary-text)",
    "baseButton.primary.border": "var(--fabric-button-primary-border)",
    "baseButton.primary.hover.bg": "var(--fabric-button-primary-hover)",
    "baseButton.secondary.bg": "var(--fabric-button-secondary-bg)",
    "baseButton.secondary.text": "var(--fabric-button-secondary-text)",
    "baseButton.secondary.border": "var(--fabric-button-secondary-border)",
    "baseButton.secondary.hover.bg": "var(--fabric-button-secondary-hover)",
    "baseButton.outline.bg": "var(--fabric-button-outline-bg)",
    "baseButton.outline.text": "var(--fabric-button-outline-text)",
    "baseButton.outline.border": "var(--fabric-button-outline-border)",
    "baseButton.outline.hover.bg": "var(--fabric-button-outline-hover)",
    "baseButton.danger.bg": "var(--fabric-button-danger-bg)",
    "baseButton.danger.text": "var(--fabric-button-danger-text)",
    "baseButton.danger.border": "var(--fabric-button-danger-border)",
    "baseButton.disabled.bg": "var(--fabric-button-disabled-bg)",
    "baseButton.disabled.text": "var(--fabric-button-disabled-text)",
    "baseInput.bg": "var(--fabric-input-bg)",
    "baseInput.text": "var(--fabric-input-text)",
    "baseInput.border": "var(--fabric-input-border)",
    "baseInput.placeholder": "var(--fabric-input-placeholder)",
    "baseInput.focus.border": "var(--fabric-input-border-focus)",
    "baseInput.disabled.bg": "var(--fabric-input-disabled-bg)",
    "baseTextarea.bg": "var(--fabric-input-bg)",
    "baseTextarea.text": "var(--fabric-input-text)",
    "baseTextarea.border": "var(--fabric-input-border)",
    "baseTextarea.placeholder": "var(--fabric-input-placeholder)",
    "baseSelect.text": "var(--fabric-input-text)",
    "baseSelect.placeholder": "var(--fabric-input-placeholder)",
    "baseSelect.focus.border": "var(--fabric-input-border-focus)",
    "baseSelect.menu.bg": "var(--fabric-bg-overlay)",
    "baseSelect.menu.border": "var(--fabric-border)",
    "baseSelect.option.text": "var(--fabric-text-primary)",
    "baseSelect.option.hover.bg": "var(--fabric-button-ghost-hover)",
    "baseSelect.option.selected.bg": "var(--fabric-button-ghost-active)",
    "baseDropdownSelect.bg": "var(--fabric-input-bg)",
    "baseDropdownSelect.text": "var(--fabric-input-text)",
    "baseDropdownSelect.border": "var(--fabric-input-border)",
    "baseDropdownSelect.menu.bg": "var(--fabric-bg-overlay)",
    "baseDropdownSelect.option.hover.bg": "var(--fabric-button-ghost-hover)",
    "baseSwitch.track.bg": "var(--fabric-bg-subtle)",
    "baseSwitch.track.checked.bg": "var(--fabric-accent)",
    "baseSwitch.thumb.bg": "var(--fabric-bg-surface)",
    "baseSwitch.border": "var(--fabric-border-strong)",
    "baseBadge.neutral.bg": "var(--fabric-bg-muted)",
    "baseBadge.neutral.text": "var(--fabric-text-primary)",
    "baseBadge.neutral.border": "var(--fabric-border-strong)",
    "baseBadge.brand.bg": "var(--fabric-accent-subtle)",
    "baseBadge.brand.text": "var(--fabric-accent)",
    "baseBadge.brand.border": "var(--fabric-border-brand)",
    "baseModal.text": "var(--fabric-text-primary)",
    "baseModal.backdrop": "rgba(36, 33, 31, 0.36)",
    "baseModal.inner.border": "rgba(255, 255, 255, 0.7)",
    "baseModal.highlight": "rgba(255, 255, 255, 0.9)",
    "baseModal.header.bg": "#f1efea",
    "baseModal.footer.bg": "#f1efea",
    "baseFloatingWindow.bg": "var(--fabric-bg-overlay)",
    "baseFloatingWindow.border": "var(--fabric-border)",
    "baseFloatingWindow.shadow": "var(--fabric-shadow-xl)",
    "baseFileDropzone.bg": "var(--fabric-bg-surface)",
    "baseFileDropzone.border": "var(--fabric-border)",
    "baseFileDropzone.hover.bg": "var(--fabric-bg-muted)",
    "baseFileDropzone.active.border": "var(--fabric-accent)",
    "baseColorPicker.bg": "var(--fabric-bg-surface)",
    "baseColorPicker.border": "var(--fabric-border)",
    "baseCodeEditor.bg": "var(--fabric-bg-elevated)",
    "baseCodeEditor.border": "var(--fabric-border)",
    "baseCodeEditor.gutter.bg": "var(--fabric-bg-muted)",
    "baseVariableInput.bg": "var(--fabric-input-bg)",
    "baseVariableInput.border": "var(--fabric-input-border)",
    "baseTopbarButton.bg": "transparent",
    "baseTopbarButton.text": "var(--fabric-text-chrome)",
    "baseTopbarButton.hover.bg": "var(--fabric-bg-chrome-hover)",
    "baseTopbarButton.active.bg": "var(--fabric-topbar-button-bg)",
    "baseProfileDropdown.bg": "var(--fabric-bg-overlay)",
    "baseProfileDropdown.border": "var(--fabric-border)",
    "baseProfileDropdown.divider": "var(--fabric-border-muted)",
    "baseProfileDropdown.text": "var(--fabric-text-primary)",
    "baseProfileDropdown.muted.text": "var(--fabric-text-muted)",
    "baseProfileDropdown.shadow": "0 18px 46px rgba(36, 33, 31, 0.16)",
    "baseProfileDropdown.header.bg": "var(--fabric-bg-elevated)",
    "baseProfileDropdown.avatar.bg": "var(--fabric-bg-elevated)",
    "baseProfileDropdown.avatar.text": "var(--fabric-text-primary)",
    "baseProfileDropdown.avatar.border": "var(--fabric-border)",